text,labels
 We already have gun control  Who would have thought that criminals wouldn t follow the law? Let s make more laws telling them not to break THOSE laws!,0
 Best news of the day,0
 Lol I m sure Paul manipulated people last season and we called them followers cuz they saw the threat and didn t do anything  Kind of what Kaycee &amp; Angeela are doing this season  They both wanna take Tyler all the way knowing how much of a final 2 threat he is  That s following,0
 Well sure she would lend her support to the lying heifer making the false accusations  She has no more intelligence than the rest of the liberals acting out sombody!,1
  real goal: To make everyone in Wisconsin as dumb as he is  URL,1
 Dude   what happened to you? #messedup,0
 josh as slave leia,1
 That s just what Satan would say if he were threatened ,0
 *as fuck  Not ass fuck  Although conservatives are fucking us all up the ass right now ,1
 So then why was it cool for all the other candidates to discuss issues with Russia over multiple decades?,0
 No one believes Schumer  Dems dont and nod with a wink happy to obstruct with lies  Swampers    same thing  And actual conservatives know its an actual lie and pray for the liars to receive Gods wrath  How sad that truth and justice are dead ,0
 Gotta admit   shes stacked ,0
 YAY - AWESOME MAGARepPowerVotestrengthened by PowerPrayersRed Tsunami,0
 You are such a fucking pu$$y little chinless Donny ,1
 Ive proven that gun control leads to lower gun deaths  Youve chosen to ignore it and accuse the study of being falsified without any proof  Do you have any proof they used 5 states as you mentioned? Or are you going to continue to ignore me asking for clarification?,1
 He is a man who allowed the wife of one of his coaches to be abused for years while he covered it up  AND threw everyone including his own wife under the bus to help himself when all of his lies (he never thought anyone would know)came out  He is a total pos,1
 agreed fuck that guy,0
 I believe that Melania Trump is an abused woman maybe not physically but definitely mentally by an abuser husband and she is afraid to speak out against her abuser ,1
 Like liberals push more gun control laws to suppress our right to own arms?,0
 You are apiece of shit! WHY WOULD YOU KILL THAT ANIMAL? How is your mother?,1
 Someone needs to give this woman a puppy  She is not enjoying life ,0
 He is not a Dalit or a Muslim no need to remember,1
 And i can show you plenty of lefties like antifa getting pummeled like the weak punks they are lol,1
 It amazes me how much in synch you are with the man who commuted your prison sentence  It s no wonder that you like each other ,0
 Mon bye bitches suffisait,1
 You were made a fooln of last night by Kavanaugh so like a spiteful child seeking attention youngo on your wide eyed rant  You are an embarrassment to the chamber and this country,1
 Civilians Also I ll admit its hard sometimes when helping Grok 24-7 lol I ve been called names I didn t even know existed Example Antifa Grannies Brokeback Valor (WTH is that) Grok Girl Friend (Yep No Shit) Things Frauds will say Thank You Grok (Brother) ,0
 When do you post on conservatives declaring Ford a liar without evidence? URL,1
4/ Even before that  in 2015  Britain s most senior Foreign Office official that the Conservatives  prosperity agenda  was now more high up the list of priorities than human rights URL URL,0
 She is a master of twisting words  That is her greatest skill,0
 Who is fawning? And who are you to decide who is and who isn t reasonable? It is fully possible to be reasonable and still be wrong  I m guessing you have never watched Daves show and are going by what you have heard from people you are fawning over ,1
 Very disturbed by how this platform has become like a dictatorship from the Soviet state ,1
 Flake shld end his search for relevancy   He s RINO filled w hatred for POTUS  #Despicable behavior ,1
 WELLSAIDShe gets more negative feedback than anyone ever!! Because she is always defending her BAD BEHAVIOR! Way to show her little girl how to act!,1
 IB you ass  Watch how you speak on my name,1
 She is also The Rocks wife,0
 MEANWHILE    Greatest economy ever  More jobs for blacks and hispanics in history  401K is kicking ass  MS13 and ILLEGALS are being DEPORTED daily  NK is back to the table for denuclearizing  Trump is draining the corruption of DOJ and FBI  #OUTFRICKINGSTANDING! #MAGA2020 URL,1
 You are beloved! ,0
 Why is this crook walking free?,1
 That s deplorable  Still haven t explained why this is relevant to me somehow  I ve also appeared on the same exact show with an AntiFA homosexual who has HIV ,0
 UK Govt non announcements are the only consistant and affordable policy under Labour or Conservatives for decades  Designed for a soundbite  No immediate resource required  Never likely to ever be implemented  Its propoganda but sadly it has its desired effect ,1
 Check out my blog post on scooters!,0
 Or maybe this   The very fine people  the dipshit  president  was talking about  Antifa isn t the  left   They re a fringe  far left  anti fascist movement  To lump the  left  in as antifa is to lump the  right  in with the neo nazi s and kkk that vote with you   Shhh  URL,1
 All 20 of them! Hardly a problem until the Antifa of hundreds showed up      for what! To riot and destroy!!!,1
 He s not an opportunistic liar  Nor have you proven he is  So your whole argument is fake news ,1
 Oh i thought you were the dream team minus sonja  Really you are the mean disgusting team minus sonja  Oh by the way dorinda leave sonja alone  You are so jealous of sonja  She is kind sweet and so much prettier than you  Get over it you drunk,1
 Collins is not who she tries to make people believe she is ,0
 If the LEFT would just stop the politics of distraction he will keep more promises #MAGA,0
 He can suck it ,1
 I REALLY REALLY wish you had a Prime Time spot Harris you are my favorite and soooo pretty too,0
 Were so far beyond tax returns  This crap affects all Americans and liberals are too stupid to wake up and understand whats really going on  Step aside  The adults are here to do it ,1
 Holy shit- how brainwashed can ya be?,1
 You are a disgrace,1
#Muslims and #Islam finally got their #WhiteSupremacist #Terrorists they have wanted for so long they can harp on about and say were worse than them    Two 15 year old boys from #Ramsgate! Jesus #MAGA #MEGA #MCGA #MBGA #Conservatives #Patriots URL,0
 Cant rehabilitate a pervert zero tolerance So disappointed in this pope,1
 HYT ENEMY OF THE PEOPLE,1
#Nikes attempt to alienate more than half the country grabbed so much attention nobody noticed Levis going full gun control and partnering with the clowns from Everytown  If a leftist company goes Woke and nobody notices does it make a sound?,0
 Conservatives want the PM to submit to their friends in the wh and the Kremlin  Trudeau should stand his ground and stand for Canada,0
 You ready for crazy ass racing tomorrow???,1
 Trump addresses gun control representing the NRA  I will not let you down  he says  URL,0
 This shit is staged  Dude didnt even hit him URL,1
#Leftists and #Commies in the #USA are going to get a little bit riled up me thinks?! #MAGA #MBGA #MCGA #Socialists #Lefties #Conservatives #Patriots #MEGA #Trump #Democrats #Republicans URL,1
 You are such a comedian edd!!,1
 Looks Like The Jokes On Liberals Again  #FortTrump #Poland #BoomingEconomy URL,1
 But he IS ,0
    how you want to be defined ? PUL-EASE! When you live under a 24/7/365 MSMedia SHIT-SMEAR to the point you have Marxine Waters sending her ANTIFA minions out to threaten you in public places - you learn not to give a F*CK what the  Pavlovian Left  thinks  Night  night ! ,1
 Just imagine if the two million spent on the security for the next royal wedding were allocated elsewhere,0
 These you are too young responses are condescending af  Personally I have no issue w/wire coat hangers being used to protest b/c god forbid women don t have access to safe abortion some may try any method to attempt a termination   esp teen girls,0
 This is not surprising  They re conservatives and they generally lack empathy for people who aren t them ,0
 I agree  Those antifa nutjobs should be arrested before they start trouble again,1
 Eject him from the Senate  What rule will he break next time  If you cant follow rules you shouldnt be a Senator ,0
 Element of surprise has gone then Somehow i think this is more,0
 Further proving that #LiberalismCausesMentalRetardation and #Feminists are a cancer on the American Republic,1
Elizabeth Warren Fundraises off Sexual Misconduct Allegation Against Kavanaugh URL via ,0
Opportunist to the max  An evil lier also  URL,1
 Ive never seen anyone talk like that on Twitter before and Ive seen some really messed up shit,1
 You are very welcome Gordon and Shirley xxx,0
 He is the worst person ,1
 For the hol tl to see  Thats tht Big Dick energy ,1
 She is a wannabe Hilary Clinton   Cant stand that woman and anything that the NDP stands for  I believe that they are even more dangerous than the liberals!,1
 HE IS MOE,1
 Why would Feinstein even waste paper on this anonymous letter she is not well ,0
 He s quite beautiful for what he is,0
 when is enough enough? This is abhorrent and inexcusable  Your fearless leader seems to have forgotten that he is a public servant  URL,1
 Son please dont make me cry today because I never saw this shit,1
 My husband is getting his PhD in physics while I m getting mine in chemistry  We usually get the wide-eyed recoil that clearly says  you are not normal humans  and I can have nothing in common with you   Followed by the polite excuse to stop talking with us  ,0
MUST READ #MAGA URL,0
   it will be hard to believe any female accusers   ever again   especially liberals who lie for personal and political gain    URL,1
 Somebody s terrified  What will happen when the #American public knows the #truth about what you ve been doing? #DrainTheDeepState #MAGA #Trump2020 #KAG URL,0
 I have him in 2 leagues and he is probably getting a lifetime ban,0
 The #metoo movement has turned out just the way black lives matter and Antifa turned out  Started out as a worthy cause and then ruined by a bunch of bandwagonists  More harm than good ,0
 She s tragic because she is an idiot and because she had tremendous internalized misogyny  I think of the moment we are in the grips of as the Tyranny of the Half-idiot ,1
 Poor Germans   they have refugee violence and antifa violence  it must be nice to live in Germanistan ,1
 Thats messed up  #WalkAway Congresswoman M  Waters has ZERO control of her demon within  Thats what happens when she &amp; other stupid a_ _ greedy folks willfully submit their souls to the Devil  Satan was defeated again in 2016  #AmericaFirst #MAGA ,1
  offers a different view on why liberals outnumber conservatives at universities: URL URL,0
 lmaooo you are so wise ily,0
#Professor Who Shot Self Over Trump Says Gun Control Was Actual Goal #AR-15 URL URL,0
 And you can see how close he is to tears  I know how hard it is to lose an old friend  They re irreplaceable ,0
 Yes she is,0
 It s difficult to talk to liberals like you with a serious mental disorder read the book by Michael Savage Liberalism is a Mental Disorder check it out on Amazon,1
 Don t be surprised when Libertarians win in local and state levels  People are getting sick and tired of both sides with empty promises ,0
 You are such a great friend ,0
 She is one of our greatest so you be thrown under the bus for that bad judgment ,0
 This  Is  Not  A  Trial    was exactly my point  She is not obligated to present evidence there that could otherwise be presented more convincingly in a different environment ,0
 But the Frogs said it wasn t a Muzzie terriorist attack ,1
 They are hoping all over it  But then they are probably the biggest crowd of racist bigots in the country they back antifa,1
 I know you guys are scared of ANTIFA,0
 We play at Connies on Sat woo,0
 The more this woman talks the more stupid she becomes  #TermLimits #Liberals,1
 liberals drink their own Kool-aid  They live in these bubbles and they think a lot of people like them  If they could see themselves how clownish they look and act ,1
 Can t take what they dish out? Joe you are a snake that should be hung by the neck on a live cnn feed ,1
 The FBI would be the proper authority to administer this polygraph despite their corruption at the top of their organization ,1
 you are a racist fake site of fake profiles with fake pictures of scammers who block you  also you delete accounts for no reason and block emails for customer service  same fake people on by the hour  all date sites are fake who create the profiles themselves ,1
 Only Liberals sexuality childrens puppets  #TuesdayThoughts,0
 there is a point where even liberals must question motives,0
 Shes so far up in the clouds shes long since forgotten what common sense is let alone how the American people feel shes just another Michael Bloomberg trying to push her views on everyone else and the state she represents,0
 And the definition of freedoms is also important  For instance  most of those countries have strict gun control  Some will also jail you for calling somebody a name on Twitter  Against the law in London to carry a pocket knife  However  some label those freedoms   I don t  ,0
 she is back !,0
 Go away my child  You are so boring that you can t even entertain a doubt ,1
 Now the leftist needs to condemn the violence of #antifa,0
 I seriously believe he is evil  ,1
 Meanwhile the #METOO movement happened because of the way liberals treated women,0
 He is truly adorable  Happy Birthday baby boy,0
 Thank you to everyone for making this possible you are amazing and so are the beautiful bears  I m a member of Olivers Army and I appreciate everything you do to make lives better ,0
 He passes the ball to Keita instead should have actually shot and we would not be having any discussion  If anything he is quite selfless,0
#WalkAway liberals      Your party is POISON  URL,0
 you and me both!! #chatterbox,0
 Dont they have strong gun control in Chicago? So nobody should be getting shot  Oh thats right only law abiding citizens are being shot because criminals dont understand they cant have guns   Gun control is not about controlling guns its about controlling citizens!,0
 Ntknetwork News  RNC Has Raised Over $250 Million for the 2018 Midterms  #MAGA#2A #Prolife URL,0
 Conservatives have become the cadaver party ,1
 Why cause you are unwilling to look at the science? URL,0
10 Places to promote your blog for Free for Massive Traffic If you are one of those bloggers that expect your blog URL,0
 How about corrupt PR government officials ,0
 Bwahahaha-work? They are Liberal tools honest work is for the Conservatives who they depend on to support their chubby little selves  Also I hear they are getting $50 (and free food) to be protesters   ,0
 Any updates re ending your blatant #racism as #Windrush &amp; #Grenfell proves you are #alloutpolitics #politicslive #PMQs URL,0
Amazon is investigating Chinese employees who are selling internal data to third-party sellers looking for an edge in the competitive marketplace  URL #Amazon #MAGA #KAG #CHINA #TCOT,0
 is this reputations next single ?? ,0
  the Kavanaugh accuser issue makes it evident the dbl standards the Dems use to discredit conservatives  Please release and make public ALL the names of those who used the congressional sexual harassment fund  Let all the their accusers come forward    URL,0
  should not be allowed to host if he s going to let Republicans go on and say any ole thing without mediation/fact checks  He is a waste of breath  stick to counting votes ,0
 I wonder if ground seen if Kaiser is ok if I was him I would of went and got him idgaf all he is worried about is his body building,0
#EndPC: Teaching guide for #Portland public schools celebrates Islam  communists  terrorists  #abortion; promotes #GunControl &amp; transgenders ~&gt; URL #EndCulturalMarxism ,1
  I have been watching the committee hearings for Judge Kavanaugh  is using this particular session on birth control &amp; Roe vs Wade as a window to gun control legislation  Her comments were very clear  I will not allow a politician deprive me of 2A,0
 thank you for explaining succinctly why a second referendum would be used by to rewrite the question and manipulate the answer in order to clingvto power #peoplesvote URL,0
 Back then Antifa was called the kkk  They were a known muscle of the Democratic Party URL,0
 Hi Amy   your book is on my read list   thanks for speaking out Hope you are doing well,0
 Wow those liberals are so uncivil and full of hate  #LickAWitch URL,1
 Just be careful because I got a suspension for using a meme that said gaf once! Mirror     ,0
 Ha ha yes fuck yes ,1
 URL any of your announcements every come to fruition or is it basically stealing Labour s ideas to get a few more votes,0
 Daniels said her job does not reflect her character  really  She is a cheap  sleezy porn lap dancer  The is no high road  to take in that type of job ,1
 Do you have any film of antifa?,0
// He is still in the bathroom  I really have to go ,0
 Another billionaire buffoon ,0
 What a beautiful person she is ,0
 Liberals and conservatives judge eachother on the actions of their worst characters  Liberals have in large quantities showcased a blatant hypocrisy today that will allow more people to write their ideas off because of the hypocrisy ,0
 He is on the Maintenance screen,0
 All one and five dollar bills,0
 Politico reached out to the 65 women  Only 2 stood by him  Thats 65-63=2  Gotta break it down for #Maga ,0
 Burt  A cool dude ,0
 He is sick  Very disturbed  And that comment proves it!,1
 Got your ass lmao,1
 Oh I never had any doubt   Read all about the Dirty Wars too  He is a slovenly POS   Jesuit who worships Satan  ,1
 A nothing burger  ,0
 Someone should tell her that voters have to be at least 18 and be citizens  Can t imagine adults with critical thinking skills could ever vote for her again ,0
 Nearly made me contribute to Antifa and join Facebook  Nearly ,0
 Corrupt period   last week u liberals were saying he wont release bc he has something to hide o boy u pple those pple that depend on an actor for info Wow! U pple scare me is it green today or is it yellow ,0
 The washed-out idiot #Biden feels he has a chance by insulting all conservatives who are supporting their great #POTUS   I dont think so CRAZY JOE!!!,1
 He is saaaaaaadd URL,0
#Elections News: Gun control group s political arm pouring millions into midterm elections #News #HeadlineNews : URL,0
 Hate to rain on the parade but this is most likely a 1-11 Arkansas team they beat  Glad for Mason as he is a great player but the team they beat would not be competitive in C-USA,0
13/? BOOOM  The MAC telling the to pay the public sector properly  Have that There s no magic money tree   But this is a disaster  It means the #NHS is in crisis and competing with other sectors  URL,0
 Did every other comedian suddenly die?,0
 Doesn t surprise me  Texans hate Liberals w/ Soros backing ,1
 What the fuck is this theyre trying to set him up so it looks like he somehow deserved to be shot,1
 Go head and switch from Nike to gun control now URL,0
 you are disgusting and need to be ousted  Get out of politics because Schumer you are the corrupt kind of politicians Americans are so tired of  has led this country to thrive again and Brett Kavanaugh will be voted in  Americans stand with ,1
 Better bring out antifa,0
 Honestly you people are seriously delusional! Its a good thing the majority of fans in Ottawa are Educated! Because ppl like you are scary!,1
 We all know death threat are a Resist/Antifa tactic ,0
 I have indeed A watered down needy statement  Not the robust condemnation in no equivocal terms one would expect  It begins with We note with disappointment     Such a diluted response suggests one thing: fear of the #Tories who clearly show no gratitude for your help &amp; support  ,0
 Conservatives just keep doubling down on being terrible people ,1
 alec we been knew you are problematic just get over it,0
 You are missing brains?,1
 hello i ate soup and now i m very tired but i love you,0
 What if the rape never happened and she is lying? Why is her word gospel? Many women are gold diggers avengers and liars ,1
 poor she is a rager and a shamer  sad    ,1
 Hey why dont you just leave then? Its ok well be ok without you  Let us know how much better things are where you end up ,0
 She is xx,0
 Totally  Just shown herself up to be a spoilt narcissist  The comment to the umpire that he will never be at her matches for as long as he lives? Just who does she think she is?? Not gracious in defeat  A disgrace to the sport ,1
 The killer is in the house  #MAGA #WallDoesntProtectFromAmericans,1
 Carter was the worst one term President until h was passed for that title by Oba our first Black Racist President! Kinda like a Black Jefferson Davis!,1
 Looking at her lawyer I bet she is really into IT  already! ,0
 Another terrorist brought in by obumer!,1
 Move to North Korea where you will find all the oppressive authoritarian gun control you want  Any one of these other countries with low gun ownership should work for you too  Good luck! URL,1
 Yeah bitch we put him back in and beat your sorry asses the bears SUCK!! BLEW A 20-0 LEAD LMAOOOO,1
#RedWaveRising2018  A Texas gun control platform? Someone drank Koolaide in concentrate ?! URL,0
 Look at his reaction at the 18 second mark  What a contemptuous clown he is ,1
 No wonder liberals are so messed up! Watching and supporting trash tv!,0
 Because he will have ate it,0
 2 ways for President Trump to lose in 2020  Gun control and an immigration bill with no wall ,1
OBAMAS LYING SKANK MARIA HARF #DNCwbore #LyingSkank #KavanaughConfirmation #ChristineBlaseyFord #RedNationRising #KAG #MAGA #CCOT URL,0
 hey bitch daily reminder that i love you,1
 and if you re in ANTIFA you are one of them shit for brains  Here worship your queen she needs her toe cheese licked out  URL,1
 She picks some random conservative issues from US and try to force fit in Indian narrative  Next might be gun control ,0
 Give me a fricking break  They are worse than the Southern Baptist with a pagan idolatrous ,1
 Where is boy wonder on gun control?,0
 Liberals never follow through on promises  Weve heard it all before  Coward ,1
 We are here for Q and the Revolution  Do not allow the shiny objects to divide  Take a step back and look at all of it from that way  #MAGA #WeThePeople ,0
 Glad she is OK,0
 Pretty much  As Ive stated I believe is gun control just not this aspect of it  The guns arent the problem the people who shouldnt have guns are  Where do we draw the line  How do we prevent bad or crazy people from shooting up a crowd  Surely we dont have the answer,0
 Calling conservatives hillbillies   hmmm thats original  Funny how many poor hillbillies you tweet about have incomes and IQs 4 times higher than you  Your humour sucks btw ,1
 And yet he is  Better than anyone before him,0
 We waiting on mean ass Florence to do what she gonna do  Ack,1
 4) The first bullet point by the fool Cillizza also is wrong  This was clearly politically manipulated just like Thomas/Hill in 1991  It is shameful that pundits like Cillizza excuse Democrats for such cynical manipulation but hold conservatives to higher standards ,0
 God dang! Didn t she break campaign finance laws? Why isn t she in jail?? Didn t she promise to move out of the US??? Why won t she just Go Away??!!,1
 Holder s day is coming  Soon     ,0
 I hope you are voting for on Thursday ,0
 Spill the T sis hehe,0
 Are you really serious?! Comparing some of the most prestigious positions in the nation with being a slave? You just keep proving your ignorance &amp; inability for logical thought! #MAGA,1
 Conservatives who quit rather than fight betray every claim that cons are patriots  &amp;  will fight for our Constitution   It reveals extremism &amp; defeatism at once  Dems KNOW they will win if they stick together  History PROVES it  ,1
 Woooow he is so awesome !!! URL,0
 Haven t watched it in years  #NoNFLZoneHome #QAnon #MAGA ,0
 I do not need a female packing a weapon for my protection  Not my kind of girl  If you need that much protection You are in the wrong place ,1
 Restricting ammo is infringing upon right to bear arms  How about women can have abortions but restricted to 1-3rd week of pregnancy and must be registered Easy test of gun control laws - apply them to other rights to see if theyd be supported  If not then they are bad,1
 Unless you live in Sweden the Gang Rape capital of the world  Where 1 million migrants were welcomed with open arms  Not vetted thanks to the liberals in power  ,0
 Exactly what I think ,0
 I know the brown shirts  in the UK were not an arm of Government then but ANTIFA and the protection they receive from our police and as shown the German Police seem to act like it  ,0
 Idk what to think about her   but with her eyes like they r   she is naturally bugging out all the time   which is untrustworthy,1
#Tories #Labour #GE2017 #Conservatives Conservatives URL theresa_may: We have three fantastic shortlisted Conservative candidates for Mayor of London in ShaunBaileyUK andrewboff and joymorrissey - all proud advocates for London  If y URL,0
 Good come back  lol! #MAGA,0
 Unfortunately in America a system like that would be called racist  Liberals believe exams are racist against minority groups ,0
