text,labels
 Hahah a left telling a right he is making everything political   too fn funny!,0
 Im glad you do babe (I kiss you back) now lets get going you are coming tomorrow to the final right babe,0
 And I have concerns withDemocrats,0
 AS IT SHOULD BE!,0
 A horrendous act of course  Conservatives lie like they breath and are just generally awful human beings  I dont doubt the victims story even a tiny bit,1
 Isnt the NRA that propaganda pushing corporate lobby group that cares about profits and only profits? No idea who the rest of these crackpots are  That guy looks like he has an AR15 stuck up his ass ,1
 Fluffy was found ,0
 LMAOOO fucking love you see you hotties soon xox,1
 Another uninformed,0
 We ve got a big story coming out (most probably next week) about the Communist origins of Antifa  I hope you can join us ,0
 He should be removed with the rest of the islamic invaders ,1
 Rosie hugs him tight Hello Angy   She smiled happy  Im so happy that she is back and I bet you Levi will be here in a few seconds   Levi walks in and gasps  ROSIE!  Levi ran over making Jack smile ,0
 dont perpetuate colonialism  If you are going to talk about #puertorico you must have Puerto Ricans in the panel! Jeezuz fucking christ! How difficult can that be? #disporaenresistencia URL,0
 Even those who voted leave did not vote for this ,0
 Funny how he thinks he is soooo important   not   ,0
20180917: Don Pittis CBC: Is the People s Party of Canada liberal? It depends on the definition URL,0
 I just know my family lives out west  Hard core conservatives  They love Bernier  All their friends love him  That is going to split the party  Alberta is huge PC block  Not my politics but you cant choose family  ,0
 Eric who? Never heard of him  Must work for CNN,0
 How did Britain end up upside down in the ditch with all four wheels spinning lazily in the air?  How could it not  with the rabid wealth thirsty drunk on power  at the wheel? #BritishToryCarCrash #ToriesOut ,0
 Hes comin for ur woolly bitches,1
 Quick Preview Summary: Blame Democrats Blame Obama Blame gun control Blame blacks (passively) Blame Democrats,1
 man can we hang out you are hilarious,0
 Suddenly BozoObama is NOT politician    &amp; certainly NOT that HE &amp; BillAyers &amp;DISGRACED ErikHolder started Police brutality Antifa BLM OWS  movements  &amp; didn t fund our US military as B4 for 8 yrs but GAVE WORLD SPONSER OF TERROR IRAN $170  bil    NOOO!; not ol  ISIS-LOVER  Bama  ,0
 Hmm cats and dogs are not raised as food  But I understand what you are saying ,0
 Now I see why the Conservatives love him!,0
 Its Good for our Gun Business  More Guns sell when these people bring up Gun Control  Keep up the Great Work  Guns for All ,1
 Agree  People forgetting how good he is ,0
 Aww  I tried lol  She is such a smart ass though ,0
 Why didn t she save her grandfather in Puerto Rico if she had that kind of cash? Bc She is socialist ,0
 Sir now to Russia    Putin is broke and a little bit crazy   The paltry 1 7 Trillion GDP might cause desperate actions from his dying regime  Denuclearization in exchange for oil patch tech  Thats all they have   Sir  MAGA,1
 As we should declare ANTIFA a terrorists group and investigate all of it s members ,0
 shes dead ass serious too  Smdh,0
 Conservatives Are NOT his fan base have not been forever!!!!! Just trying to take out #Beto support and this is BS!!!,0
 More people scared of what the Liberals will think and say about them  This is rampant around conservatives  The only ones who ever stopped giving them that power were the Trump movement and they absolutely won everything including the internets ,0
 Fresh boy think he is strong ,0
 Not by the tea leaves you use by simple logic  You know that thing that comes from common sense  Right no you don t know  Winning Deplorables MAGA God Bless you ,0
 hey Samsung on your website you declined me  2 times for credit I can afford your phone without your ass this is my second one maybe next time even though I hate iPhone I ll buy iPhone so screw you,1
 I seriously have no more words for how fucked up he is  Every time I think I found the word he does something even more despicable &amp; disgusting  The best I can do is hope that he chokes in his own vomit for all of the stupid lies he s told  Like a serial killer he has no soul  ,1
 Nope  Not going to miss his sorry ass at all ,1
 And apparently Serenas cheating and temper tantrum was the only pathway to this endeavor ,0
 Dirk isn t a plumber  He is top 25 all time  Dan Majerle and Danny Ainge shoudn t be mentioned in the same breath as him ,0
 Gail has dropped far if she is going after actors like Rob to deal with the frustration of being a has-been   ,1
 You just said publicly aligns with neo Nazis  I asked which and you cant answer got it  Source for your ambush tactics please  By your definitions Im not sure you know what a paramilitary is  Do you classify Antifa as paramilitary?,0
 confession  i was pregnant with your child after our second makeout  he is 7 years old tomorrow ,0
 Cube has shown in the past that he is not in control of this  The investors on the board run the show  And they are super cheap ,1
 I still can t believe that you are 51 years old and yes your mom gave you some great genes,0
 The GOP has blood on their hands  GUN CONTROL!!!,1
 Do it with quran and then we will see how much atheist and brave she is    hindus figured it out that this type of attention grabbing big boss wanna be people are not worth it    Go live in your 2 minutes Prime Time covered life     Lord krishna and his followers don t care,1
 Did I say that no typical liberals,0
 Gun control kills 3 more people ,1
 Mr  Woods    Please help if you will  has published an ANTIFA target list on his Twitter Account with names of high profile and other Trump supporters  I have reported this to Twitter  They have NOT suspended his account ,0
 Dear Lord  Do you have a CLUE what the Black Panthers stood for? The STILL stands for SENSIBLE Gun control Laws  We have LAWS already in place to prevent people who should NEVER own firearms from EVER obtaining them  NOW? Talk to your LEO about ENFORCING them  GUNS arent,0
 Well  see  if I start talking at Dana about sensible gun control laws and she ignores me (or calls me a tragedy dry-humping whore  as she did then we aren t having a conversation  I m just talking into the void  ,1
 He is ,0
 Hey genius Hitler was dead two years before Trump was born ,0
 Mickie is 39 now? She is on her way out ,0
 Families being separated at the border  In fact  the picture of children in cages that Liberals were using to show how evil  Trump is was actually taken while OBAMA was President ,0
  We did a great job of electing and a terrible job of who we sent to congress to support him Conservatives left frustrated as Congress passes big spending bills URL,0
 She took a polygraph to prove something to her husband  I think they were in counseling because she is frigid with her husband and he wants to know why  So she made up a cockamamy story as a coverup for her current lesbian affair ,0
 He is an awesome dog  Almost worth the trip,0
 If the conservatives  aren t standing up against Dumpster s unconstitutional and illegal activities  then they are just as complicit as he  and henceforth  supporting the tangerine toddler s policies and actions  FFS  be Americans before party loyalists  Or else we all lose  ,0
 Anyway she is a man and a mother  it s about time she gave it to an actual female  Congratulations to Naomi! She has class &amp; skills! ,0
 I have backtraced your IP and have sent you information to AntiFa ,0
 You are welcome  ,0
 Chris You are just stiring the pot and it is a political dig  How about Texas how were things handled there  PR was a totally different situation  How did you help?,0
 You act like that won t be fun for both of us   She contemplates getting down  he s been gone for a few minutes and she s just standing on a chair like a weirdo  Just as she is about to get down she sees him walk through the door   Technically I only thought about it   ,0
 Also he supports antifa,0
 #Westminster #Tories Absolutely pathetic #appeasement ,1
 you are amazing,0
 Drill baby drill,0
 But what makes you think they are liberals? There is nothing liberal about any of that  These people spent the  90s insulting liberals  publicly humiliating black activists  and openly attacking the New Deal  Where is the liberal  part? They passed GOP policies! ,1
&gt;Literally runs through the wall  There was now a hole  Master! You are okay? URL,0
 If you want to #MAGA: 1  Stop Intellectual Property theft by China  2  Pivot away from China and give business to other Asia countries  3  Ask US business to move to other countries 4  Tax reciprocally 5  Make Xi look weak! Demolish South China Sea  Xi is a crook! ,1
 Wasn t the organizer of the rally that killed someone it was someone that showed up just like the people that show up to antifa and black lives matter rallies cause violence and rioting everywhere they go,0
 You 100% believe AB would be the player he is today without Big Ben?,0
 I would Starfleet Antifa was here to witness  RIP,0
 Deserved better,0
 you are very creative :),0
 OMG!!! She is perfect!!!!!,0
 Lmao good one ! Now listen up Sparky your wife is a disease she is a bought and paid for evil soulless propaganda arm for child murderers and Russian agents  So stick with your cutsie tweets but I d prepare for a long prison sentence if i were you ,1
*goes to song suffragettes* Waitress: theres a $15 minimum food and drinks charge Me to waitress : who do you think you are?,0
 Bullshit! My daughters and I watched the tennis match and sarrena got what she deserved  We are big Williams fans  No one is above the game ,1
 BE GONE THOT (no offence intended she is probably a very nice lady),0
 He is telling you he knows where his bum is  Writes ass with his bottom  What more proof of higher intelligence do you need?,1
 Like ANTIFA ,0
#british politics on #brexit (and in general) start to look like one gigantic benny hill episode #may #BorisJohnson #brexiteers #corbyn #chequers #conservatives all my sympathies to #fbpe #PeoplesVote,0
 She does not remember? Of course she doesnt! She is making it up as she goes and with the help of her therapist and all the others that believes her BS story  Maybe if she gets hypnotized she will miraculously remember more details #Freakingliars liberals obstructionist,0
 trump may not be the one who started this mess but he can stop it  If he doesn t he is part of the problem ,1
 Brilliant journalistic commentary here,0
  Think she is one of the Demoncrats  Hard to imagine that a sane (or living) person would vote for her ,0
 Hate mongering is No solution for NFL KNEELERS - change up your playbook losers,1
 Been a Willie fan since before most of you were born    LOVE that he is holding a rally with Beto     Exactly WHICH fans are furious? Could you give some specifics? URL,0
 You are NO CHRISTIAN,0
 what the fuck do you gain from posting on your private instead of your public,0
Kavanaugh Accuser Christine Blasey Ford May Testify Before Senate Judiciary Committee  URL #TCOT #MAGA #RedNationRising ,0
Bias Blockers: The New Glasses Made for #MAGA Racists and Homophobes WATCH URL URL,1
IN HONOR OF #ConstitutionDay I PURCHASED A #TRUMP t-SHIRT AND A #MAGA HAT #TRUMPTRAIN #LIBERTY #FREEDOM #AMERICA #USA #LIBERTY URL,0
 That or she is an awfully good transvestite,1
 Omg!!! A good guy is now evil!!!! Same thing happening is America!!! The Globalist world leaders with all their money would have us believe what is evil is good and what is good is evil!! Ive read that in the good book!! For the end time!!!!,1
*waits for a buncha braindead rednecks to burn the Levi s that they re wearing and get hauled off to the ER en masse* URL,1
 Hope they bankrupt soon,1
 vs Antifa  I know who my moneys on  But seriously this is such a stupid thing to do  URL,1
 This is not conservative  What has happened to our party ? Lost the plot  ,0
 This is why we follow each other -such peace in my Twitter Avenue is amazing URL,0
 : When we lead  sheeple follow  URL,0
 Lol #liberalfool just MAGA,0
Americans are smarter than you think  #MAGA #VoteRed2018 #RedWaveRising2018 #SaveOurCountry #VoteDemsOut URL,0
 Breitbart must be hacked! Your headline says it all ,1
 Awww kaise bache ki tarah she is holding his finger,0
 He s NO POPE!!,0
 Well you are picking the wrong ones,0
 I dont know why they can see she is lying they should leave him alone   They need to write an article now when they wanted to write 1 10 months ago   Just so you know you make no money with Melissa  ,0
 This has already been rejected as you well know  This is another time wasting exercise ,0
 2018-09-14 23:57 Congratulations! You are on no blocklists that we can find by scraping publicly available blocktogether lists Please check my follows for people incorrectly blocked - URL,0
#guns #2A A Second Amendment Zone  is Ridiculous  So Are Concealed Carry Laws Daily Utah Chronicle: The latest installment of the nations endless debate on gun control recently surfaced on the University of Utah campus  A g URL URL,0
 You are phinnaly there!,0
 Bring out his Antifa criminal son to campaign for him,0
 Lets not forget the treatment of Sarah Palin by these same California liberals  And now they say Kavanaugh s accuser is being bullied?,0
 I don t think you have a clue what leadership and liberals have the temperament of 2 year old children being told no    you have the intellectual brilliance of a goat   please stop tweeting  TDS is making look quite the fool  ,0
 Stop talkin about urself,0
 The holy spirit is given when you are saved,0
 You are so correct the Democratic party for slavery and pro-nazi gun control,1
 Wait you don t know who she is? Oh boy,0
Democrat can t even compete w #MAGA URL,1
 Lol  My 6 year old is home today ad well and was in tears as she is receiving her star of the week Award and will miss out ,0
 Djt &amp; Gop- MAGA  Only for old scared white men again  Making women property again ,1
 She is just spewing sh*t Bernie s robot what a lie they will say &amp; do anything and what she is going to do for district 14 not a da*n thing Socialism don t work that way they suck all up ,1
 Maybe he is a Baker by day     and sleep at night cuz have to wake up early to open the bakery     ,0
 Ya Obama on trade 2-YEARS AGO: Trump is just NOT TELLING THE TRUTH   How STUPID could our leaders be  Trump God bless Trump! #MAGA #KAG    (Full Link+Trump s ANSWER URL,1
 He won t live long now,0
 You are probably the best politician Ive heard in a long while   wish you were in Illinois!,0
 Amazing how Dems dont feel they owe it to unborn generations to keep ILLEGALS out!!,1
 I think you made those liberals upset,0
 According the gore hurricane hazel in 1955 was Trumps fault and all the typhoons cyclones and hurricanes are all Trumps fault And Trump colluded with God to defeat Hillary  All true!,1
Aint missing shit ,1
 Do you support our POTUS? (Please help by retweeting and following after voting!) Follow Follow Follow #maga #kag #trump,0
 Sensible gun control can only help  Mentally unstable people should not have guns  People with restraining orders should not have guns  No one needs a gun with a magazine more than 5-6 rounds (unless the zombie apocalypse happens) ,1
 The war on the right = Antifa,0
 1 of 2) Support Chief s comments  I d recommend reading excellent true crime book  In Plain Sight:The Kaufman County Prosecutor Murders  - by Kathryn Casey  Victims were all armed (DA  very heavily) and prepared to  protect themselves   Not about gun control  but    ,0
 primary argument against #Kavanaugh is that he is too Constitutional  The democrats started a civil war during Clinton They heightened their propaganda during Obama They are scared animals backed into a corner Antifa  BLM &amp; MS13 are their Sturmabteilung ,1
5 of 5 stars to You Are a Badass by Jen Sincero URL,0
 Good Morning! I just followed you back! Let s give these crazy Liberals Hell!,1
 You rock brother  I am proud of my Antifa badge of honor I earned last year!,0
 BS  People died in PR because the local government is corrupt ,1
 you are a sorry excuse of a rep - I hope that your district votes accordingly-you need to go! Your nose is so brown it will never be clean! URL,1
 She is the bomb!!,0
 But he is still fucked up for not respecting LGBTQ,1
 Even her brother thinks she is a monster: URL,1
 Cause they re assholes,1
 I love Danielle because she is such a caring and genuine person! Her smile and positive energy brings out the best in everyone  You can always count on her to bring some sunshine into any rainy day ,0
 Of course  Thanks for making my point  ANTIFA has no clue what fascism is ,0
 We ve had a good conversation  Many will condemnations me for my part from both sides  It does not matter  This is what gun control is about  Discussion ,0
 And dying a slow death such a shame,1
 he is on the island dummy,0
 Manafort has been on K street for a long time  He knows things  Deep dark things  I agree  He is gonna burn some folk  Mueller already knows who he wants  Manafort is gonna give them up ,1
#conservatives everywhere in my small red town  kids need to be spanked and put #God first  They need to know consequences!   Also them   #BrettKavanuagh shouldn t be held responsible for something he did at 17!! #Hypocrites how do sleep at night? ,1
 Choosing heartless politician over your ancestors country  Speaks volumes as to who you are ,1
 I hear he is having an MEI on his knee due to the pressure exerted  Lol,0
 Another overdose nigga:(,1
 The liberals are really displaying hate &amp; their message of division  Republicans really need to take advantage of this by welcoming the disgusted democrats that had enough with their party &amp; want a solid policy &amp; no more insults ,1
#SesameStreets #Bert and #Ernie came out of the #closet today  Spox says theyre a loving #couple  #Conservatives incensed  Rush out to buy Bert and Ernie dolls to burn along with their newly purchased #Nike fashions  #Gay #lgbtq #lgbtqtwitter #bluewave URL URL,0
 Just another BLM brat blocking a highway  ANTIFA thug swinging a bike lock  Here comes just another screamer from the gallery - except this childish scoundrel screamed he RAPED me!   sat down in the middle of the room  stuck her thumb in her mouth  and whined  prove me wrong!  ,1
 Gotta give him credit where its due he may not be a mason but he is out there competing his ass off,1
 Get that boy a pie! Stat!,0
 Stop Collins  There is someone who will support woman  Dr Cat London  She is opposing Collins and we can end the BS  All she needs to do is clean out her desk and go home ,0
 She s an absolute queen  thank you for being the strong and emotionally passionate woman you are!,0
 Dont care  Let them (NFL) die on the field kneeling,1
 He is revolting ,0
 GOOD!,0
 God bless my uncle has cancer too but she is in a better place now,0
 The touch makes him stiffen  hips pressing into that touch    I m not a fair maiden to win and carry home  Barnes  I /bite/   And yet  he is merely holding on  no longer unaccustomed to such man handling    ,0
 He is an incredible leader and a true hero  Thank you Chef  ,0
 all out war  with is hilariously insubstantial ,0
 Bono   get out of town,0
 NEITHER DOES ANTIFA OR BLACK LIVES MATTER OR ANY OTHER SOROS FUNDED GROUPS,1
 Antifa = Democrats = Dixiecrats = KKK URL URL,0
 she is and tea is she used to be in the program oop,0
 u never talk to me shut up[,1
 I still can t read an analog clock like I can but it takes me like a fucking minute to process it and I can t just glance at one like a digital click,1
 Oh no! Hope you are okay ,0
 Agreed  Bring your dollar bills!,0
 I fucking loved that cat I am so sad,0
 yea shit sucks thats why i stopped watching anime mostly,1
 Whoever put this together thank you !!!! I loved watching and the little circle on 18 made it so much better  You are really awesome Jude Thaddeus Wolfe! So fun to watch  Proud of you Boochi!,0
5/5: The time is right for this House to respond to the concerns of all Canadians  Four out of five Canadians support stronger gun control and with good reason  #guncontrol #cdnpoli #cdnhist ,0
 #Liberals are muck rakers  They have NO platform to run on  NONE! Culling vulnerable people from the late decades    of the last century    of the previous millennium    shows how desperate they are to be heard  Now theyre loitering around high schools looking for rumors  Sad!,1
 You go girl! God bless you and all the survivors and for getting young people out there to vote for common sense gun control,0
 I SHITTED/SHAT YTD AND LOST 0 6KG CAN U BELIEVE IT,1
 Yall are the best,0
1) This argument that  boyhood  does not deserve scrutiny only seems to apply to white boys &amp; men of high socioeconomic status  Kavanaugh should be judged for who he is today  influential political voices  mostly conservatives  argue  not what he supposedly did in high school   ,0
 Would have been far cheaper to relocate jobless/homeless to bulgaria where property is super cheap &amp; many speak English  You prefer the expensive brexity way  You re governing  I wouldn t do it that way  Ref was non-binding call for opinion  Disregard it  Was 50/50 near enough ,0
 Consider the source  It s only Bono ,0
 Shid I m right with ya,0
 Oh The Dem candidates do have clearly stated policy proposals  One involves rational gun control  When elected they wont vacillate like Trump  You and are done deceiving America ,1
 Interesting that the GOP and even liberals are placing the burden on the accuser  This isn t a trial but an examination of whether Judge Kavanaugh reaches a high enough standard to shape U S  law for several decades  The burden is on him ,0
 Speed test on computer wired and see what speeds do you have,0
 Kamala Harris speaks to those she disagrees with in a condescending fashion that I find gutter like! I want to snatch her bald headed routinely! She is so full of herself and is very unbecoming! ,0
 found out the name but I forgot ,1
 Bitch shut up    cyberpunk was announced way back in 2012 and just now getting revealed #    get your facts straight,1
 CORRECTION: The Liberals won a false-majority on the backs of a lot of close races emphasis on false  #ElectoralReform,0
 Conservatives *lied*!?! About their virtues? This is my shocked face ,0
 Did this happen when she played her sister? Mom!!!! Serena beat me over my head with the tennis racket again  Now  Now  Mommy will bake you some cookies and tell you how your sister is marginalizing your existence ,1
    and the RINO speaks    again Sassy has been one of the most frequent and vocal critics of Trump policies calling out Trump for his handling of issues ranging from gun control to tariffs Thinks about quitting ~ don t the doorhit you URL #FoxNews,0
 Was Al Gore nominated for Supreme Court judge? You conservatives have some nerve ,1
 You know you re a racist monkey huh? I m sure you know what you are a piece of trash  I never hear these pieces of horse shit speak the truth only their racist lies  Bitch boy it s ABOUT THE RACIST COPS KILLING UNARMED BLACK AND BROWN PEOPLE!! THAT S THE FACT  ASS CLOWN!!,1
 He always shows dedication at what he does no wonder he is the best URL,0
#Westminster #Tories #Brexit #Brexiteers #OutOfTheEU #EU #Brussels #Remoaners #Remainers #Quislings #FBPE #Non-Patriots #Anti-UK #Pro-EU #Traitors #snowflakes #bedwetters #LeftieLuvvieLiberals URL,0
 I am and I m voting absentee for the first time in a midterm!! #MAGA,0
 She is full of it  She will go for it ,0
 Why wasn t we given the chance to change our minds for 43years also if we have another vote and you win can we change our minds again or will all changing of minds be banned when you get your way,0
 #TrumpDerangementSyndrome Case number 3837252 Wow #liberals got it bad about the same as the #msm,0
 David Dennison might know where he is ,0
 Looks Like The Jokes On Liberals Again  #FortTrump #Poland #BoomingEconomy URL,0
 and he took away the constitution from us  congress refuses to restore it to us why is that? Article 4 sec 4 was taken away   and because of that there are NO gun control laws anymore  OBAMA is a STUPID MAN,1
 He is cute,0
 As we now know there were scandals  They were covered up very well  That s coming to end  Slowly but surely ,0
 Melting snow flakes,0
 BOYCOTT THE ANTI AMERICAN NFL  Football ain t all that anyway ,0
(you are probably wondering why we was frontin about them  I forgot to add that my father told us that their grandparents were coming over to check on us  AND they never did for the whole day but they decided to do it now  So we forgot) We ran as fast as we could to the house URL,0
 Gun control at its finest  If that cop had a gun he wouldnt have been vulnerable to this thug attack ,0
 Yes If only Antifa would leave the poor Nazis alone is a statement for the ages   ,0
#deepstate you are going down! #MAGA #RedWaveRising #redwave #WalkAwayFromDemocrats #WalkAway #WalkAwayMarch make this viral URL,1
 if you ever want a record setting bad election for the liberals in quebec you need to go back to this URL,0
Aint got shit done today,1
 Why didn t Kavanaugh need terms? Guilty people: those are the ones that need terms  Let me clue you in: they re worried that she is going to make a terrible impression and will not be believable  They re trying to manage that concern ,0
 Thanks she is sweet  Very very timid skiddish scared of every sound so this hurricane isn t helping her adjust BUT today she started being playful,0
 Then we ll be talking about gun control! ,0
