text,labels
Trumps Lies Have Grown Far More Frequentand More Dangerous Mother Jones URL Truth decay     #maga  We re doomed  ,1
 You still have not addressed your solution to make schools safer    you just preach more gun control   what are your solutions???,1
What if I told you there s a group in Israel &amp; in America that has been controlling US foreign policiy for decades using spie lies &amp; quasi blackmail schemes  would you believe me? #MAGA #AmericaFirst The URL,1
 Everyone in the US heard you were clearly not qualified to do this job and voted accordingly ,0
 So let me get this straight they want us to hold off on the confirmation hearing for what? Polygraph is inadmissible  All to hear he said she said? Ford signs paper in trump case against illegal separations? And Cavanagh has just about every woman stating he is honorable  Vote ye,1
 you are no patriot if you actively try and disrupt the will of the People simply because you lost the election  When has it ever been patriotic to undermine the Presidency? He is working to bring prosperity to every American ,0
 7 $ million buyout  Losers ,1
 This is what happens when you tell white liberals that they don t get to congratulate themselves on how woke they are until they put their money where their mouth is  That simple fact of life breaks their brains ,0
 So?what s wrong with white guys?  I m a PROUD Caucasian &amp;Colombian American woman and I happen to like ALL these WHITE men that represent me  especiallySen Kennedy   We are soooo done with identity politics from liberals ,1
 He s beyond moron ,1
 incoming the gun control patrol,0
 Threats from who? Are liberals threatening her if she does not follow the playbook?,0
 and they will know she is the Lord,0
 Bro we are one big happy family,0
 IT WAS OFF THE PLATFORM HOW IS THIS OK!?!??,0
 Reasonable gun control = use 2 hands ,0
 The only thing this is going to do is make the #MeToo movement even more of a joke than it already has become  I don t think anyone is falling for this BS except for maybe Antifa ,0
100% Follow Back Conservatives must stand united! #Trump45 #MAGA2KAG URL,0
 I guess its time to get divorced just so we can keep more income  How silly is that  Liberals have no clue  Make it so all Canadians can benefit not just divorced couples  #whatareyouthinking?,0
 Wait until he is on your coaching staff and you will change your mind ,0
 thank you for the consideration     be careful it might be you !!!!,0
 I cant think of a worse 3 game start for a coach at such a big time university in my life  1-2 and almost lose to Fred Samford University lol I know its Sanford  But yea they still owe him whatever he is owed,0
 This is incredible  She is being demeaned because she stood up for herself? I hope she knows she has many who support her and stand with her  She is an example for other women ,0
 How about showing patterns of intent  The march in Charlottesville  That s a perfect example of patterns of intent  Where is that proof with Antifa? Where did they go purposely to denounce black people in America?,0
#GreatestThingsAboutThe90s NOTHING  The treacherous lefty media people made sure Benny Hill was taken off TV and even more treacherous conservatives  conspired to remove Maggie Thatcher as our leader then almost fatally signed us even deeper into the extremely hostile commie EU ,1
 Go home and sleep Johny ,0
 shut the fuck upppp kliff i m bigger than you and gayer than you so don t try any shit,1
 Do not donate  She is picking and choosing who she donates to  Being reported ,0
 Fair &amp; square  Remember that when youre thinking why! The laws are why  The people spoke and they will again URL,0
 No reporting on the death threats faced by Kavanaugh or ANY conservatives huh?,0
 She is so damn cute! Def with the facial expressions,1
 They really don t care who he is  Only that he will act as a judicial alt right operative on the Supreme Court ,0
Chances got s Mario Cart penis confused with one of the few thousand shes had since then  Can you remember what a specific slice of pizza you at 15 years ago looks like? Dems like ancient memory based accusations #ConfirmKavanaughNow #MAGA,1
 This kind of meme just drives me further away from the Conservatives  My mother and father are rolling in their proverbial   you know  They would be disappointed in the lowness of it all ,0
 Are you freaking serious  3900 lives lost  Trillion dollars in recover and rebuild  Continued threats and fear  You are a disgrace to journalism  You moron!,1
 Disappointed in Taylor  Serena was wrong  dont use your gender to be disrespectful  Serena should apologize to the winner &amp; ref,1
 Nhs is only the way it is because we have a over populated country Conservatives have privertised were nhs buys from,0
 on What-Platform is Fundamentally-Restoring-AMERICASpeaker will Konk-U on Ur-LameBrain w/ Gavel,0
 It is metallic color  Tomorrow I go to get it It was my birthday gift,0
 Another Pile of B/S By the Former A-G !,0
 left!!! URL,0
 I think you are so in need of a Dairy Queen ,0
 Hmmm its almost like gun control laws dont work  Which means that there must be something more than guns that are the problem     ,1
 That s the plan for next summer actually  We need it for shade and I was thinking that could be a fun side project ,0
 A Bernie supporter tried to assassinate #Republican Congressmen; another assassination attempt in CA; Sen Paul attacked @ his home; Trump cabinet members &amp; supporters harassed/attacked all over the country; when will a single #Democrats speak out? Bob? ,0
 I loathe ,0
 I ll bet she is a liberal democrat ,0
 he is ,0
FBI Had  Two Sets Of Records  On Trump Investigation; Comey  McCabe Implicated: Carter  URL #TCOT #MAGA #RedNationRising ,0
  HOSTILE ENVIRONMENT against the POOREST and most VULNERABLE in our society just keeps on rolling  So much for #ChristianMorals eh? If you voted for this SHIT then HANG YOUR HEAD IN SHAME  #JC4PMNow #POVERTY #DisabilityRights URL,1
 Tip  He is no franchise QB ,0
 Anti abortion is not about the sanctity of life  Its about the subjugation of women  If it was about life then the paradox you point out would not exist and gun control would be pursued ,0
 Bring back Alex     Jack    or Ban NYT too   ,0
 Why would someone be videoing ? Inside job? asking for a friend   Hope she is ok  ,0
  You Sir are correct  There are so many GOOD MEN  She is completely out of line  URL,0
  was first Trustee to join to lead the charge since 2015 to divest from fossil fuels  She is a true accomplished progressive who actually gets results  Vote Letitia James for NY AG tomorrow Democratic primary Sept 13th URL,0
 We support you Dana in anything you doyes you are a heck of an actress  Thank you for fighting for us  NRA Proud  MAGA  BLESSINGS DANA ,0
 Containers of Hurricane Donations Found Rotting in Puerto Rico Parking Lot URL,0
 I think #AltRight is going to burn their jeans next     URL,1
 Unbelievable!,0
 Jeff Flake looks like he is flaking out on the confirmation ,0
It is the consensus of the Republican Party that sexually assaulting a 15-year-old girl should not disqualify a judge from sitting on the highest court in the land and making life-or-death decisions about women s health  #MAGA,1
 Best female tennis player ever? Arguably  Great player  She is starting to age and become less unbeatable ,0
 I can see how frustrating that is  Conservatives will always get more praise for humane policies because it isn t neccessarily expected of them ,0
 Rescue conservatives from its own demons? Who are the two or three most notorious serial abusers of women in the last 30 years? Hint: they were not GOP  Did they ever face consequences?,1
 Sleazy CNN afraid of Trump GOP but tough on liberals ,0
 My coworker has a sick ass one for work,1
 has the same lack of morals as her mother! Abortion is murder!,1
 Keep banging on with your nationalist nonsense  Once democrats win the midterms and raise taxes you ll be able to get on the same page as everyone else  Universal health care and gun control will save countless lives  Trumpsters like you will learn eventually ,1
Don t these PIGS have a job? Don t these SLOBS have a life? Where is there outrage against bill clinton keith ellison harvey weinstein THESE PROTESTERS ARE HYPOCRITES! #MAGA URL,1
 Nurse is valuable in his own end!?!? Have you watched him play? He rarely gets the puck out in first attempt  Also not all that spectacular defensively  Not worth what he is holding out for ,1
 Hmmmm what about the MEPs who we elect in the UK who attend the European Parliament to represent the UK? Its a framework under which we operate  Were not the victim until we leave and are then subject to rules we dont even control  Its a #BrexitShambles  Lets stop it ,1
 and no one is attacking Trump supporters at large  Ever heard of Antifa? I thought you were leaving long ago anyway? Why are you still wasting my time? ,0
  just picked up my post on gun confiscation  This is the history of gun control your high school and college history classes will NEVER tell you about  URL,0
 I don t live in the US so maybe that is one reason why i don t know who she is ,0
 I dont think so  it would mean he is in trouble  Dont wish that on anyone  Isn t that where the Cumm Inn is at?,1
Shits about to Hit the Fan  #MAGA URL,1
 Dividing us is no longer working for hollyweird Demoncraps or liberals #race card no longer helping you,0
 Certainly does URL,0
 So Fucking What  It doesnt matter if they found the Dead Sea scrolls or the Colonels secret recipe  This man should not be dead but he is so due to the ignorant negligence of someone else ,1
 It matters less than swaying the political slant of the SCOTUS by both parties  Thats a fact  This is only important to libs and conservatives as to the Court makeup ,0
 But not long ago the same Ray went off on a follower (who quite possibly pays for his services) for pointing out a guy (dont remember who) for getting injured again  You guys pay this assholes bills,1
 Tough crap Mazie! There should be a Me Too  for men with false accusations against them as well as those hurt by Democrat lies  false accusations  biased government agencies  biased media sensationalism and Antifa bullies etc       ,1
 Except for the little attempted rape thing he is just a wonderful guy,1
 Antifa has new uniforms?,0
 #WhyRWPreachesRacism #RWLuciferianCult I keep saying and its not simply rhetoric    These people are not by ANY Bible definition CHRISTIAN anymore than the Christian  CONservatives who attended public lynchings of blacks often held as public spectacles on Sunday after  Church  URL,0
  oath must be subpoenaed to testify  There is a lifetime appointment at stake here  Please do it right this time &amp; do not allow Orrin Hatch who has already made up his mind she is lying be allowed to question her  His kind of questions could invite a lawsuit ,0
 your pappy is a big fat fool the Democrats doesnt have to make him look bad he makes himself look just what he is an ignorant 5th level FOOL,1
 Hopefully he is gone soon  We have glorious beings for you to meet  URL,0
 I m tired off that piss poor excuse from conservatives  which is pretty much synonymous with  bigot  nowadays  It s not fear they feel  it s shame  The same shame all hypocrites feel  ,0
 #Police are priority for funding! Our country is overrun with crime  Degrees of lawlessness in #UnitedKingdom,0
 Fuck yes ride it baby!,1
 Damn catholics ,1
 She is such a witch  All she needs is a broom,1
 Crying babies !!!,0
 Chequers delivers Brexit (changes the relationship with the EU)  It does not deliver leave the European Union  (referendum question ) I think we should stop using the word Brexit to mean leave  and actually say  leave the EU    Brexit  meaning willfully mutated by remainers  ,0
 Sir I know the difference pretending to be someone else is lying who you are the age where you from etc etc etc  but thats not the point the point is a lot of people are doing both and they been doing it since forever to kill their victims  And it sucks!!!,1
 This is the most ridiculous tweet Ive read today  Comparing the traitors that are the #cpc to the liberals is like saying the democrats and republicans are two of the same  Grasping on straws  Pathetic,1
 That was a little too curious,0
 Oh hes getting louder!,0
 You re a glutton for punishment  You ll never see eye to eye with any blue wave drinker on this topic  Till you agree to ban all guns  Especially the scary ones ,0
 rae sis don t say no offense  then like tweets calling me a sad bitch  also im truly shocked ur on the L6 train this year ,1
 damn that headgear is lit sucks im not on pc ubi plz for console to,1
 In other words #Mueller its not constipated In other words #Mueller has diarrhea? URL,1
 He is a disgrace he needs to resign or the citizens of Maricopa County need to start a recall  If he FUBARs the General Election that should be it  No waiting until 2020 ,1
 What death threats? Antifa is not sitting outside her house like they have with Republicans  Why did she scrub all her social media?,1
 Typical violent antifa    hooligans are stalking California causing mayhem  URL,0
 And dont forget #supplymanagement! He has been stubbornly clinging to that that tax  It also distorts all of international trade deals  Just makes life less affordable for the average working family  Only the Liberals   ,1
 As a gun control leftist: I d rather a child had a responsible parent that locked the front door and didnt let her get involved in the neighbors DV  Shir  if the  22 was where she could grab  it  but couldnt leavem shes lucky he didnt find it first  ,0
 Be sure to just cover liberals  p o v  That s what you do  Not fair &amp; balanced ,0
 The response from the US was exceptional  The implementation in Puerto Rico was abysmal because of the Democrat Mayor  She hoarded the supplies and only distributed them to her allies first and withheld it for the rest  She is still under FBI investigation,0
 Yoongi you are the father!!! URL,0
 The UK only has a fraction of the population &amp; had a fraction of the number guns we do not to mention a gun culture &amp; demand of which there is ample supply here  UK type of gun control will not work here but will exaserbate the gun problem ,0
 Cause gun control worked so well for chicago?,0
 Good for her!,0
 He s a big crybaby because he didn t get his way for the 2016 election,0
 Awh shit ,1
 Great  Heres how today has gone: Floris wanted to spank me  Leah wanted to stab me  Curtis wont back me up  Adam still looks great at 67 or however old as fuck he is    KL has a bigger dick than me but shes a she   he   she?!? URL,1
 Not even close to what happened she is a liar and deflecting how idiotic her actions on the court looked,1
 She should have gotten August off to let work on stuff at the P C  It would have help her a lot ,0
 Look at her moving and not one word of Truth coming out of it  If you ever get a chance to ask that layer a question ask her do you agree with me that the Golan Heights belong to   She is dead dead in the water she couldn t answer it without condemning herself true,1
 Bill you should be silent on gun control and immigrantion  You had 8 years and did nothing  Don t be a Monday morning quarterback now  To little to late ,1
 Wow more Salinsky tactics,0
 so we load into illios insta lock torb immediate flame in all chat moira do not win a fight all game constant shit talking between a team mate and one of their team still have a torb im fighting a doomfist help,1
 I head a little boy?,0
 He is the best!! They ended them all ,0
 You mean like the Democrats do to push their gun control agenda?,0
 Fuck a drug test,1
6 people shot and killed in Bakersfield and the liberals want to tweet about Gun Control  Chicago calls 6 people shot and killed a lunch break yet nobody tweets a word  You cant have it both ways  Legal guns ownership vs illegal gun ownership  Whats the real solution?,0
 Good Day I trust that you are well Please send me your email address,0
 THATS gun control ,0
 Trust me it aint ok to hit 16 - 21 year olds if you are 25 - 30 (in my opinion)  But where were her parents???,0
 ummm last time we checked chicago already has gun control    the atrocious gun violence didnt start with trump   ,0
 She is just great  As long as she wins the title eventually,0
 Already Following!! Fantastic MAGA Patriot!!! ,0
#FamilyProtection: Gun Control Supporters Are Once Again Rebranding Their Efforts [we re on Facebook @ LivingTrust - FREE California #CCW class - PLUS virtually unlimited Free Training at Front Sight (world s largest shooting school)] URL,0
 Antifa is a domestic terrorist group URL,1
 He hit the lotto,1
Again if the economy is booming why is gas so MOF high 2nd question this is for the #MAGA cult how will making cars go half as far on gas doubling your cost to fill your tank make Fucking sense to you? #TuesdayThoughts URL,0
 By citizens he means democrat voters   ,0
 Again for the hard of hearing: An AR15 is an INANIMATE object  An AR15 is not INHERENTLY evil  Gun control DOESN T decrease gun violence  Armed citizens are LESS LIKELY to become victims of mass shootings  The Holocaust was not prevented by BANNING ovens ,1
 Shes a great comedian  Where as you are a great    nothing ,1
 It s probably better to have an next to my name than a pink pussy hat on my head #MAGA #MakeAmericaGreatAgain,0
 He is perfect for the part! Im with it  ,0
 we are done  you have no knowledge base for any of this and you are drunk on lies ,1
 Poor Joe he is in bad need of some attention so he attacks the President and his supporters  He said jobs a 3 letter word was the key to prosperity  Guess who delivered those?,0
 So as per new promo it will be Maulis journey so you are making her as a shield because she is the saving grace left the leads less said better,0
 Holder has a perverted view of the law  Not surprising since he is a Democrat ,1
7th and 8th grade football will be looking for parent volunteers to help assist with our concession stand  If you are interested you my email me at darell maddox,0
 Not progressive at all Article II  section 1 of the Constitution 1790 says he is a citizen and 44 years as a resident of Texas says he can say y all  ,0
 Just another reason she is vile,1
 And don t forget his telling a primarily black liberal audience conservatives want to put them back in chains  ,0
    is he the insider working against Trump?    really looks that way - release the hounds!!,0
 LIAR!!! What supporters is she talking about??? I was embarrassed when our last president went on a world apology tour and he even bowed to them like he was their servant!!! URL,1
 just vote yes we all know you found out she is a fraud ,1
 LMFAO NO But he is in his undies,0
 Rivera is shit  He is the last one left  Our problems run through him  The day we fire the better off we will be,0
 Several of the western liberals are not too happy with national focus of Saudi ,0
Is anyone surprised that a President who would commit treason with Russia to get elected would pick a rapist for the Supreme Court?#MondayMotivation #Deplorables #MAGA #MarinesagainstTrump #KavaNO #BlueWave2018 #PostponeTheVote #Kavanaugh #StopKavanaugh,1
 Oh shit the mafia have finally found me,1
 and bale is shit,1
    I happen to know of your wayward conversations with Patricia Hewitt and hooking back up with the very same Liberals you are who sold us out to this  Go on  Tell me how your continued complicity isn t part of this  You have stoked this too  Disgusting ,0
 You are literally one of the most beautiful people I have ever seen in my entire life and I want you to know that ,0
 Please take John Harwood s pen away  He is incapable of unbiased reporting ,1
 Ha! Ive met you both and neither of you are dull! Me on the other hand     ,0
 Of course she is ,0
 Antifa simply wants us to kill them  By the way  Most of us carry a back up  And a knife,1
 so sad and preventable  Lift gun control in Chicago  Allow decent people to defend themselves ,0
 KKK and ANTIFA both hate groups created by the Democrats,1
 Girl so am I   LOL he is actually grown now ,0
 Now what are you ?? A Liberal ?? Intellectual ?? You are nothing but a Bigot  Shamelessness at its peak ,1
 Always looking for faults and forgetting to look at the whole picture  Journalism (objective reporting) is dead as now everyone is a pundit (subjective expert) ,0
 No  I mean parasite in the sense of private companies being an unnecessary and universally-unwanted bauble imposed on an essential public service by people who put profits before public opinion and democracy ,1
 That s the problem with conservatives  They mix up etiquette and talent  Both in moderation ,0
 No he is in some other world he dreamed of when he was on drugs in colledge,0
All aboard #MAGA URL,0
 Anti-Kavanaugh Groups already spinning that he is guilty before any disclosures and due process  Aggressive tactics! Lets see the all the spin from both left and right!,0
 Are you saying theyll become another victim of the Clintons?,1
 Thank goodness he is not MN passive aggressive  Love it!!,0
 Its a shame you are so damned unattractive   ,1
 she is not paid off  look her up here on Twitter  they are being horrible to her ,0
 2) That s even an ANTIFA motto  By any means necessary  ,0
 Youre Yesterdays #FakeNews trying to make a comeback at the desperation and obstruction of Do Nothing #Liberals &amp; #DemocRats  Who cares what happened when you were a Minor in high school  Youre not the victim here  Just another MeToo sexual misconduct Baiter and Switcher ,1
 Thats hilarious! Try again  Its the liberals and their media lackeys that have done just that  ,0
 Antifa methinks !!!,0
 to be reported to for inciting VIOLENCE against Trump Supporters  He is making lists to target Trump Supporters for Antifa   ,0
 He s just another JERK,0
 What wrong in criticising Muslims seeing as they do it the British people and get away with while we brits get labelled racist and fascism blame it on the liberals for letting it happen ,0
30+ years as a JUDGE   6 Extensive backgrounds   NOT a peep   link to TRUMP   BOOM    Do conservatives only rape liberals??? URL,0
111007 - i love how active you are on twitter  Forever shining on my TL - Dislike: dont event know you to dislike anything tbh,0
 URL If youre not an ancom then you should be on my side,0
 ur so straight forword man i saw u in dance dewwane and ur just talk free ky ap kitnay porrany ho industry mein and i really like ur this quality that u even gather with ur senior artist love for #Manmarziyaan ,0
 I don t believe she s even getting death threats  Conservatives don t roll that way  Plus her &amp; her attorneys bankroll is Soros,1
 I can t watch CNN anymore because the conservative pundits they have on are just partisan hacks  I get CNN wants balance  but the conservatives that defend the indefensible are too much  ,0
#Spanish #unjustice vs  #FreedomOfExpression and #HumanRights #Spain is a #fakedemocracy #cddr #shameonSpain URL,0
 Its unfortunately not as cut and dry as all that  Gun laws vary per state  Even cities  Compare Chicago that has extreme gun control with New York that has almost the same level  Yet Chicago has horrible gun crime and NY not to that extent? Criminals are the problem ,0
 who really cares about any of this wack ass beef???,1
 Sod the EU  Tell them you are gone by Monday and enjoy the panic that follows ,0
 The truth for the gun control/anti-2A URL,1
 Thats all I ever ask for tho ,0
 Isn t express entry a taxi cab to #RoxhamRoad ?? No paperwork  No line ups  Police carry your bags  You re put up in a hotel  You re given $50K by the Liberals ,0
 Mann i aint that smoove booty like you gee ,1
 The real reason they want gun control ,0
 That s funny she says she is a mental health counselor yet has displayed the actions of a complete paranoid phycho!,0
 Have you all seen this from Antifa about disarming people in open carry states? URL,0
 He always was in on it ,0
 God help us!,0
 DOXX her  See if she is as Lilly white as she puts on ,0
 with the caption so much for the tolerant left      yup you fit the description of ANTIFA   I suspect you are not a threat as I doubt you can attack any reporters from your mom s basement  ,1
 Than we wonder why the Dems  are blooming idiots here is a fine example  How to teach your kid to be a vulgar protester  Way to go Dems  this kid will grow up to become President of Antifa ,1
 He is not the best receiver in the NFL when healthy ,0
 You are devaluing everyone s opinion on the Independent article whom agrees with me by saying they are disgruntled students or bots  Just because they don t put Dr  In their Twitter name it doesn t mean they haven t done  deeply important research  as you fondly put it ,1
 I will not be playing your game on android EVER as 1) I m downloading an all from an unknown source and 2) I think all Epic Games should be banned from the android system as you are stripping the revenue that pays for the dev and it s unfair on other devs like me ,0
 The Dregs of Society  are ISIS  ANTIFA  BLM  Planned Parenthood  Illllegal aliens  Pedofiles  and liberals  This is who the Democrats support  Once again  accusing others of what YOU  Biden are guilty of  ,1
 What I dont understand is the fact that hes lied about almost everything to do with Russians and collusion and still he is president ,0
 Full truth and justice     URL,0
 The gauge potential is the connection on the quantum field as like in differential geometry  and the field strength tensor is the curvature tensor ,0
 All U S  WW2 vets are antifa ,0
