text,labels
 I dont think it was her race or looks  Biden and liberals were put on strategic defensive by CT s claim that he was being electronically lynched  He played the race card and liberals folded like cheap suits  GOPers now just do not care  ,0
 He is german he play for club fcb ssshhhhhiiiiiiiiiiiiiiiit,0
       Oh What about Kyle s since he is one of your many adoptive dads  ,0
 sorry but she is an idio,1
 She is ,0
 Look at this chill as fuck bearded dragon URL,1
 Its ridiculous  All the sock puppet accounts apparently have marching orders to start a boycott of the film  A lot of MAGA snowflakes  Thankfully most of them are on our list of known sock puppets so blocking the rest wasnt hard ,0
 And the liberals wonder why we don t want transgenders in our bathrooms?,1
 Yeah - because ANTIFA are nothing but violent thugs who assault anyone and everything ,1
 Happy now liberals!,0
 Oh my god,0
 The only deep disgrace and abuse of rights is your existence in relativity  Even the generation before mine knows who you are RAE  Low life opportunist  Government over people  Suck a liberal dick you alt left Nazi!,1
 Oh shit,1
 He is ,0
 For a moment I thought you were about deaths Sounded fucked up sick at first ,1
 The problem is  the people who will read this and go oh shit he is a cunt  already think he is  The rednecks and retards that already support him will believe it is fake news  ,1
 Bite your vicious tongue!!,1
 Conservatives not showing support on NAFTA talks gives the US more power  They are not doing our Country any favours by publicly criticizing the ongoing talks for their own political gain ,0
 What a piece of shit,1
 ORourke is just one more ignorant gun control freak        dont know what they are talking about!!!!,1
 Idk some Antifa nut job,0
 He is always on his knees anyways,0
 He shouldnt withdraw his name at all because the left has repeatedly been caught fabricating stories just like this to discredit conservatives theyre proven cheaters and liers      a liberal professor from California lol ,0
 Gun control       means being to hit what your aiming at! These elderly homeowner have great gun control!,1
 Why are you the way that you are,0
 He s got his wee fake tap fae Turkey on to prove how loyal he is ,1
 And Nero Goodell fiddles while the burns  Glad I took up golf  #BoycottTheNFL #BoycottNike #JustDont,0
 Thats right   he lies all day long and he is still terrible at it   anyone else would have mastered it by now   hes definitely got 10000hr,0
 Crazy freaking liberals,1
 Kingggg,0
 Thank you!,0
 Fear monger  Fake rage ,0
 ur a fucking dumbass fr  theres no way she is anyone elses ,1
 I m sure you are missing the irony here (as does Bojan) ,0
 Wow! I like this lady more &amp; more!!! She is such a fighter &amp; a blessing!!!,0
 Gun control does not work,0
 She is one of satan s daughters,1
 EXACTLY! Nice ,0
#Liberals + #Conservatives= #neoliberalism &amp; #Globalization &amp; all of its Discontents: #PPP-#CorporateWelfare-Dilution of #Constitutional Rights/Freedoms &amp; #Justice-#SocioPoliEconFinancial #Corruption &amp; PARTICRATIC #Collusion of #cdnpoli/ticians for 1%ers! URL,1
 Radicalism? Seriously? Lets see your so called resist movement gave birth to ANTIFA thugs who run around trying to sow chaos &amp; stifle free speech! has created a dialogue in this country that addresses the division and corruption already plaguing this country ,0
 Yes Liberals vs progressives This should be a really dumb banter Go,1
 *accept  I dont hate men  I dont hate conservatives  I hate stupid  And I hate hypocrites  And the fact that you think being a conservative matters at all in this matter means to me that you are not so much into law and order as you think you are ,1
 He is talking about you big O ,0
 If you are running a top 3 offense every year &amp; still get fired from Pitt there are concerns  As talented as he is players dont like playing for him you have to have balance cant be in your face 24/7,0
 It s almost comical at this point,0
 You are awfully quiet ,0
 People like you are the greatest campaign tools conservatives have  Thanks for your service to the #LoonyLeft!,0
 Total Bullshit,1
 I recall hearing Maxine Waters issue a summons for all people get up in the face of the Republicans and conservatives  Payback s a b**** ain t it?,0
 Where is the fascist version of Antifa?,1
 but there is also many videos of antifa attacking disabled and old people if you want to see them victors ( spoiler on disabled attack three on one antifa to disabled vet),1
 Listen to General Flynn speech  Read his plea deal #WWG1WGA #MAGA #TheRainMakers #QAnon #QArmy URL,0
 Governor of his state next,0
#Liberals had some sort of mutual masturbation awards show  This is me still not caring  URL,1
 you are welcome to join us in our Slack room for the community gardening  URL,0
 Cause I dead have no clue who she is ,0
 It sucks hy ,1
-Conservatives cut police funding -person complains about crime -person votes conservative to tackle crime ?,1
 American terrorists  We need strict punishment for these lawless thugs  STOP powdering Antifas ass  #BackTheBlue #gettough,1
   2 of 2 Vote her butt right out of office  #DianeFeinstein is part of the problem in America not part of the solution  Her old ideas and #ClarenceThomas tricks will not work this time  #VoteRed2018 #KAG #ConfirmKavanaugh #ConfirmCoachK #MAGA,1
 He is awful  And so smug ,1
*a shooting happens in a country with gun control laws for the first time in literally decades* Y all: BUT THE GUN LAWS SHOULD VE PREVENTED THIS UNGA BUNGA THIS IS WHY GUN CONTROL SUCKS BET YOU DUMMIES WISH YOU HAD GUNS *meanwhile another school shooting happens in America*,0
Susan Collins:  Puzzling  Why Kavanaugh Allegation Came So Late  URL #TCOT #MAGA #RedNationRising ,0
 nvm he is dodging us we can Play you now,0
 antinationalist? or antinatalist? also im not typically interested in basing my focus around being against something bad rather than for something good that directly counteracts or heals the bad thing  imagine if antifa was called prolib lol,0
 Especially after liberals were found buying and bribing for a no  vote in kavanaugh  ,0
 What you are saying is simply untrue ,0
 She is an activist liar who GOP wants to get under oath  She won t go and Kavanaugh gets nominated,1
 Bet Ford is a part of antifa and the Berkeley gang,1
There is only ONE reason why Christine Blasey Ford won t testify against Kavanaugh; despite her serious allegations  She can t testify UNDER OATH  She ll be a willing Dem; but doesn t want to PERJURE herself  LESS THAN 60 DAYS UNTIL NOV ELECTION #POTUS #Trump #MAGA #KAG #NEWS URL,0
 of coarse he is alex and many other nation leaders are as we;ll lapdpgs URL,1
 She is unfit for office   Mentally deranged   unstable  ,1
 bro they were laughing into her face and almost pissing their pants and i was standing beside it like wtf mind ur own business,1
54 factory workers shot dead in Oklahoma with WASR-10 Century Arms rifle  The NRA blames gun control laws ,0
 Further proves antifa members are larping   you clowns not John Wick and this not Imagination Land ,0
 Antifa: the brain child of the democRATS  #DemocratsHateAmerica #Democrats #Antifa,0
 Fat ass liar strikes again  #NeverForget,1
 for your encore say that every other western country thats all but eliminated mass shootings through effective gun control are lying too    it would be fitting,1
 To justify his death to racists &amp; bigots  They re excuse will be well he had weed so he is a criminal &amp; deserved to be murdered  Just wait till the excuses start ,1
 He needs to butt out,0
Hes Back !! James OKeefes Project Veritas Exposes The DEEP STATE In A New Series Of Videos He Exposes A State Dept Employee Organizing For The Democrat Socialist Of America While At Work And Your Tax Dollars Pay Him #TuesdayTips #MAGA #KAG URL URL,0
Understand the meaning of America by reading Creating the Declaration of Independence by and share your knowledge of the American Creed with your fellow citizens  URL #MAGA #KAG ,1
 Croatian President s bikini photos worlds hottest president ever URL,0
 do you recall what was said about moss when the patriots got him? do you even remember what he did in the few years before that? gordon isnt a hall of famer but name a 5th rounder as good as he is today ,0
 Once again if you look at the timeline the only ones who are so proud of her is liberal or white liberals  Like I tell my Hispanic community when you see liberals offended for minorities becareful these people are not your friend ,0
 Felons are  unless those freaks have changed that  Sick of them registering convicts to vote  The exact people who DON T want us to have guns &amp; will vote gun control every time!,0
 That was fucking fast holy shit lol,1
 That shimmmy ok ok ok  You are that bitch  Lmao jk,1
 you are running scared!,0
9/9 push a narrative  Remember it s their place to tell us what to think  Well I ll gladly be  as Hillary said a DEPLORABLE    IRREDEEMABLE  or as gropy Joe just said   DREGS OF SOCIETY   Tells us all how they feel about the middle class  Christians and Conservatives  #VoteRed ,1
2 hours at midnight and she said she is not a call girl? -Awkward!,1
 Doesnt the University of Wisconsin have entrance requirements or do they take anyone rejected by other Universities?,0
 Ontario Liberal MP Leona Alleslev is using you to jump the queue  The faithful back benchers are probably FURIOUS and should join the LIBERALS in protest ,0
 Ever see when someone Is stuck in quicksand and gets the brilliant idea to reach down and pull their feet out    = ESPN,0
 The epitome of class  A big fat class ,1
 Goodell is one of the worst things that has ever been unleashed on Pro Sports  Useless!!!,1
 Dumb kid,1
2) I am absolutely furious with my fellow conservatives when they say  This sounds credible   or   If it s true     Do you guys have short-term memory that only goes back 90 days? ,1
 URL It s a guy  Guy looks like a Sheila  #QANON #MAGA #GREATAWAKENING -Crocodile Dundee URL,0
Judicial Watch Sues for Records of FBI 302 Interviews with Demoted Justice Department Official Bruce Ohr  URL #TCOT #MAGA #RedNationRising ,1
 Yay! You are unblocked I see how you gently responded ,0
 Take your anti-American crap somewhere else  #TEDCRUZ for Senate!! #MAGA,1
 Maybe they should have started the checks 10 years ago Arron then there wouldnt be so many Bloody Liberals in the Party ,0
 Those liberals would have a story about Jesus if he was running    ,0
 How? Because theyve been brainwashed by Obama and the media and theyre full of hate for conservatives ,1
 I m calling it now he is still Superman but not for a long time  I think WB is letting him do his own thing and down the road they re going to gear up for Man of Steel 2 ,0
 Good morning  You are welcome ,0
 Great list  Ty  Just a heads up  I only fb MAGA profiles  Please update your profile if I havent followed you back  Lets MAGA!,0
 Hes a bitter Barn Inbred  URL,1
California - Creepy Fake Uber Driver Tries to Follow Woman Into Her Home #MAGA #KAG #California #FakeUberDriver #BodyWrapRestraint #CrimeNews URL,1
 Death to Jeremy Corbin by any means necessary !,1
 Fuck bfa im going back to rift,1
 Fantastic!!! The Alamo is sacred to us  She is a blight on the history of time  Better left erased!! ,1
 melbourne didnt like me can I join you instead I even have a flag #Rimmy4Antifa URL,0
 I don t think he needs a qualification  But good on you  I am impressed  You are an inspiration to you younger peers ,0
 Can you eat this child you are wild,0
 How about starting with gun control ,0
 He is so confused  One of the liberals running loose Beaware URL,0
54 night club partiers slaughtered in Oregon with  30-caliber Universal M-1 carbine  The NRA calls gun control research  unethical  ,0
 The fact that he is still a nominee is disgusting,1
 Did you go to the south side where thousands have died? Strictest gun control policies in the country and they dont work ,1
#HanoiJane Fonda Campaigns for Gun Control Measure; Will it Backfire? - Liberty Park Press URL,1
 Thank you for the updates    you are doing an excellent job,0
 Now we just need antifa outside when they confirm kavanaugh,0
 So youre the same people who vote for less gun control when we have what I dunno 23 school shootings just this year and 2 fatal shark bite incidents since 1936  You sure really care about humans ,0
 So Alyssa you saying hes guilty? What ever happened to innocent before guilty? And if he is innocent would you at least tweet an apology? Shut up and answer the tweet ,1
Thank You We Need to #BuildTheWall to Keep Them Out But Mandatory E-Verify Will Get them Out ! #RedNationRising #Trump #MAGA #SendThemHome URL,0
 I think he is hoping someone somewhat soviet will take care of it for him  This could get even uglier ,1
 Fuck this !! He acted like The father of the girl killed at Parkland was a bug  Instead of telling us how much he loves these girls he should tell them the truth that he really doesnt give a shit if they are killed by a crazy white guy with an AR 15!,1
 On no not roaming charges! Good charge all these foreign fuckers when they come here!,1
 bt1100 ass malfunction,1
 all conservatives are bad people,0
 A few steps to pivot away from China - TPP: TRUMP Pacific Partnership! - Tell US companies to offshore to other countries - Ban products from China that include stolen Intellectual Property - No disclosing IP to do business in China #MAGA ,0
 Bono is a Nono in my house ,0
 You are not helping people your case lol,0
 Yes keep voting until the NEW REICH IN BRUSSELS GET the result they want  Call another referendum and just see what happens  Go away Liberals your finished,0
 Is no one considering the fact that Russia might be using Antifa to spread black propaganda??? Remember the Berlin Wall???,1
 The fact that Newsweek no longer tries to give both sides of the story but instead only gives the side of #Antifa far left liberals and their gods in the #DeepStatePanic Take a look at Newsweeks circulation they dont even have enough readers to put out a print edition anymore,1
 Yes she is,0
 I was informed that your process takes up to 10 business days to transfer credit from an expired Myki card to an active cards - WTF!!!??? Do you people use computers????? #whatajoke,1
 He is contacting his followers,0
 Glad to see your friends are supporting Metis rights as much as you are supporting Zionists  URL,0
 people are awake  Projection is no longer a tactic that Liberals can successfully use ,0
 have become the party of the Sky is falling and we are all going to die  What a sad bunch ,1
 Whistleblower must be the only non kid toucher behind the Vatican walls ,0
 I #WalkedAway      from the And I m NEVER      COMING    BACK ,0
 He is such a stroke,0
 Do you know whats going to happen now? Im going to have to lay in bed and cry while I listen to Kelly Clarkson  Thanks free speech antifa ,0
 So does antifa go to Church?,0
 Fk River you are a sick individual  Get a life or make the world a better place or end yours  No loss trash IMHO,1
 Haha I doubt that!,0
 She is a liar like Hilary Clinton ,1
 No I dont know that nor do you    in fact a claim like that is bullshit  Imagine if we had never enacted clean air regulations years ago in the U S    but wait! YOU DONT HAVE TO IMAGINE   just look at the air quality in China!! Thats what pisses me off about you conservatives,1
 I met Mark  And he is amazing  He is just as sassy in real life as in the show ,1
 I hope that ENTIRE police department gets shut the f*ck down!Obviously you all feel like you re above the law Obviously you are incapable of holding your OWN accountable for breaking the law Obviously you undermine everything a police officer&amp;dept are SUPPOSED to be/do  Shameful!,1
 I am the ANTIFA Super Soldier,0
 Holder needs to be prosecuted,0
 Fuck you are killing me lately ,1
 I know many of antifa who will fight harder    and not waste government socialist money URL,0
 Srsly it sucks  When ur living life its full of bullshit rules we just gotta suck up to survive,1
 I also understand a lot of the followers are #MAGA and #Cult45 aligned politically ,0
 She lives in the hearts of all gun nut conservatives ,0
 maybe it was democrat antifa,0
 There is no such thing  Where is this fascist left? ANTIFA are anarchists  They are not socialists or Democrats  You folks on the right embrace Authoritarianism and fascism  Look at Trump  He attacks all our institutions and the rule of law and fluffs Putin ,1
 Repeatedly re announcing previous measures and funding that don t come in effect until a future date and only serve to help housebuilders make more profit isn t going to solve the housing crisis  created by Labour and made worse by ,0
 Who will abuse it the most: liberals or RINOS?,1
 #AskAlly Please tell me something what should i do to help my mom when she is at home with a broken leg cause she s in Hospital now with a broken leg ,1
 Happy Birthday again Namjoon! thank you for always sharing your thoughts and feelings with us! you are a beautiful person with a beautiful mind and heart URL,0
 What an incredibly odd little man he is ,0
 Haha Trump is still winning  Its fun to watch the liberals literally go insane  URL,1
 He is gay  Hes a sick pervert he gets on my nerves,1
+ i can t talk to anyone so if i answered your message you are so special for me,0
 Ummm  You are one of those people that shouldnt be there  ,1
Aint no pussy good enough to get broke while Im in it,1
 why should he the woman is lying according to everyone that went to school there except liberals who would say anything to get rid of him ,0
Never give in/ never give up the fight #MAGA URL,0
 all these things you mentioned mean nothing to those of us who love our country! Our freedom and country mean more to us than anything of this world #maga #KAG URL,0
 Whats your point here? Im a TX voter and I wholeheartedly support gun control  There were 0 school shootings in my childhood  I think its because civilians couldnt easily get their hands on military grade weapons  Our laws need to change,0
 No way this woman was threatened and had to move out of her house because of conservatives or Republicans,0
 Lab turned down the deal with LDs,0
 She is allergic to chocolate ,0
What I can t figure out is why it took so long to HAVE a #ConstitutionDay ! It s almost as if some of our leaders were opposed to the constitution! #MAGA #QAnon URL,0
 are you also going to address the allegations that Keith Ellison allegedly likes to beat his girlfriends? This is in addition to the fact that he supports violent antifa scumbags and hangs with anti-Semite Louis Farrakhan ,0
 Thats shitty,1
 You are absolutely right smdh,0
 Shocked???? News flash kev! Kern County has the highest murder rate in the state! We need common sense gun control laws to protect the constituents in #CA23 &amp; the nation from people who shouldnt be allowed to own a gun! #dosomething #votethemout #voteBlue2018 ,0
1 year today our founder sadly passed away  Mandy devoted her life to saving animals across the UK  We all hope she is looking down on us with a smile knowing we are continuing the work she started 20+ years ago  forever in our thoughts Mandy Leigh From all the staff &amp; Trustees URL,0
 This is just more of the standard Trudeau Liberals emotional manipulation of Canadians  They think Canadians are stupid ,1
 Antifa log tosser  URL,0
 Boy Hollywood sure does like to look like fools all the time  Wait until they find out it s a big hoax manufactured by liberals  Think they will apologize to Kavanaugh? No way ,1
 I dont think at your job is the place to protest perceived police violence or whatever you are protesting   If you really cared go to your local PD and protest there  taking a knee at a ballgame on your job doesnt take guts and only makes you look ignorant  ,1
 Hope you re right about that last part  But I ve learned it s pointless to underestimate the stupidity of TX conservatives ,1
 Sure hope Maxi marches with Antifa  She will cover her head,0
 The truth will finally get out to Congress and the American people! That the Dems are trying to take out a duly elected President  They re running scared  #schiffhead #MAGA,0
#Tories #Labour #GE2017 #Conservatives Conservatives URL introducing new laws for small businesses that will: Help the UKs 5 7m small businesses access finances easier Provide a 1bn long-term boost to the economy We URL,0
 You ladies always make me smile  if you know what I mean ,0
 Austin Rogers? YAY!!!! He is a favorite  So glad we will be seeing him again ,0
 Got you Joseph always happy to follow like minded Patriots but pls follow back!,0
 She is an ALEC puppet  If they dont move the string on her back that works her mouth then she does nothing ,1
  This seems true  At least the damage Trump has done can be undone fairly quickly URL,0
 I know right  It pisses me off he is so busy giving himself credit while we are all scared to death here in nc  I dont trust him,1
 What do you think  gun control  is all about then? It cannot be about saving lives because it has been proven over and over again that the only sure way to protect people from bad guys with guns is having good guys with guns to fend them off!,0
 Sorry Andrew but your policies will be too close to the Liberals policies and you don t seem trustworthy ,0
 What a surprise     same as antifa  BLM and so on and so on  Soros is Americas worst enemy in HISTORY  He believes the only way to take down the USA is from withing  And hes right  But it s not gunna happen ,0
 Do you think he should be impeached ? #maga URL,0
 Liberals sure love to spend other people s money !!!!!! Hope and change  really works well for the Obamas who are multi millionaires  Their fortunes have really changed for the better !!!!!! If liberals have any brain cells left  they d vote for President Trump ! ,1
 She is known to be sneaky,0
 John Kerry is a swamp rat nothing more nothing less CNN we all know is the clown news network,1
 Bill and Brooke deserve each other  They are like hot and cold  Theyre in love with this person this week and in love it that on the next  Brooke I can understand  She is the SFTV but Bill?! Theyve ruined him ,1
+++ I can t prove causation either but while the CONservatives in CDA surely love the idea of ( bashing PM can t help but think they re also egging the former to continue the bashing to boost their fortune(s) vainly  URL,0
 Soon both the libs &amp; the conservatives will havevut so everytime we have a change of government we ll be paying out cancelled contracts,0
 Mossad ,0
 He is back baby  Lol,0
 FASCIST LEFT ARE EVERYWHERE  We must crush them; boycotts work folks ,1
 What an angry person she is URL,0
 I m that nigger no lie,0
Give it a rest rice eater #MAGA URL,0
 He is 100% and ballin ,0
 She doesnt want to be near him  And if he watched the show  She never said anything about loving him she said I dont want to ruin my chance to get to the us  She is keeping it real ,0
 Shouldve played saint marie instead of london docks  Saint was ass for me ,0
 help! I already have a verify account but when I try to use it it wants further details (passport) which I dont have with me  So I phone instead and after two minutes of pointless messages it tells me you are busy and hang up!!! What rubbish service ,1
 The fact that she is disrespectful and blatantly rude has nothing to do with her situation,1
(I know there are parents among my mutuals/followers and lots of you are GREAT! But Ive had to deal with a lot who are laser-focused on an outdated idea of what early childhood education should be),0
 Reputation? REPUTATION? She schitt her reputation away by being an ANTIFA activist! Just like good old V I Lenin said - a scoundrel may be useful BECAUSE they are a scoundrel ! ,1
 And youll spend your final days in hell sinking,1
 My divorce  Everyone says  We re not picking a side   And then  they all totally do  Trials of life are great indicators about the realness of people  It sucks at first  but then the after is great  #EverybodyTalks ,0
 I m not screwed any more than you are  Been hearing this same dream of the liberals  What do you think happens if Trump gets removed,1
 I don t trust ,0
 If you are being led by the spirit why didn t you 10 deliver him from that spirit?,0
 Democrats = Thugs,1
 It is troubling to me that the top 2 Trump haters are Diane Feinstein &amp; Dick Schumer  The Jewish hatred for this country &amp; Conservatives &amp; Israel is palpable  I am embarrassed by them ,0
 That s just depressing  Good churches are getting hard to find  Few and far between  I know people who belong to churches that espouse gun control and abortion! That s politics - not God! Not Christ!,1
 Hope you paid to use the image        and the appropriate tax of course  URL,0
John Kerry Should be Made to Answer for His Meetings in Iran  URL #TCOT #MAGA #RedNationRising ,0
#Emmys didnt watch  Wont ever watch silly entertainers trying to make unfunny jokes about conservatives  So scripted and unfunny!,0
 Because Gutierrez is corrupt and so are the unions there ,1
#Toad The one on top  NObama is best described as such      #MAGA #Trump2020 URL,0
 i fully cant remember hes just always gettimg himself into shit like he never stops causing government based chaos i wish he would calm down,1
 Lol same  Mom: why dont you do art of real people? Me: he is a real people ,0
